BEA_2012_Detail_Code,BEA_2012_Detail_Name,USEEIO_Name
541300,"Architectural, engineering, and related services","Architectural, engineering, and related services"
541400,Specialized design services,Specialized design
541511,Custom computer programming services,Custom computer programming
541512,Computer systems design services,Computer systems design
54151A,"Other computer related services, including facilities management","Other computer related services, including facilities management"
541610,Management consulting services,Management consulting
5416A0,Environmental and other technical consulting services,Environmental and other technical consulting services
541700,Scientific research and development services,Scientific research and development
541800,"Advertising, public relations, and related services",Advertising and public relations
541920,Photographic services,Photographers
541940,Veterinary services,Veterinarians
5419A0,"All other miscellaneous professional, scientific, and technical services","Marketing research and all other miscellaneous professional, scientific, and technical services"
550000,Management of companies and enterprises,Company and enterprise management
561100,Office administrative services,Office administration
561200,Facilities support services,Facilities support
561300,Employment services,Employment services
561400,Business support services,Business support
561500,Travel arrangement and reservation services,Travel arrangement and reservation
561600,Investigation and security services,Investigation and security
561700,Services to buildings and dwellings,Buildings and dwellings services
561900,Other support services,Other support services
562000,Waste management and remediation services,Waste management and remediation
611100,Elementary and secondary schools,Elementary and secondary schools
611A00,"Junior colleges, colleges, universities, and professional schools","Colleges, universities, junior colleges, and professional schools"
611B00,Other educational services,Other educational services
621100,Offices of physicians,Physicians
621200,Offices of dentists,Dentists
621300,Offices of other health practitioners,Healthcare practitioners (except physicians and dentists)
621400,Outpatient care centers,Outpatient healthcare
621500,Medical and diagnostic laboratories,Medical laboratories
621600,Home health care services,Home healthcare
621900,Other ambulatory health care services,Ambulances
622000,Hospitals,Hospitals
623A00,Nursing and community care facilities,Nursing and community care facilities
623B00,"Residential mental health, substance abuse, and other residential care facilities","Residential mental retardation, mental health, substance abuse and other facilities"
624100,Individual and family services,Individual and family services
624400,Child day care services,Child day care
624A00,"Community food, housing, and other relief services, including vocational rehabilitation services","Community food, housing, and other relief services, including rehabilitation services"
711100,Performing arts companies,Performances
711200,Spectator sports,Sports
711500,"Independent artists, writers, and performers","Independent artists, writers, and performers"
711A00,Promoters of performing arts and sports and agents for public figures,Promoters and agents
712000,"Museums, historical sites, zoos, and parks","Museums, historical sites, zoos, and parks"
713100,Amusement parks and arcades,Amusement parks and arcades
713200,Gambling industries (except casino hotels),Gambling establishments (except casino hotels)
713900,Other amusement and recreation industries,"Golf courses, marinas, ski resorts, fitness and other rec centers and industries"
721000,Accommodation,Hotels and campgrounds
722110,Full-service restaurants,Full-service restaurants
722211,Limited-service restaurants,Limited-service restaurants
722A00,All other food and drinking places,All other food and drinking places
811100,Automotive repair and maintenance (including car washes),Vehicle repair
811200,Electronic and precision equipment repair and maintenance,Electronic  equipment repair and maintenance
811300,Commercial and industrial machinery and equipment repair and maintenance,Commercial machinery repair
811400,Personal and household goods repair and maintenance,Household goods repair
812100,Personal care services,Salons and barber shops
812200,Death care services,Funerary services
812300,Dry-cleaning and laundry services,Dry-cleaning and laundry
812900,Other personal services,"Pet care, photofinishing, parking and other sundry services"
813100,Religious organizations,Religious organizations
813A00,"Grantmaking, giving, and social advocacy organizations","Grantmaking, giving, and social advocacy organizations"
813B00,"Civic, social, professional, and similar organizations","Civic, social, professional, and similar organizations"
814000,Private households,Household employees
GSLGE,State and local government (educational services),State and local government (educational services)
GSLGH,State and local government (hospitals and health services),State and local government (hospitals and health services)
GSLGO,State and local government (other services),State and local government (other services)
S00101,Federal electric utilities,
S00102,Other federal government enterprises,Federal government enterprises
S00201,State and local government passenger transit,
S00202,State and local government electric utilities,
S00203,Other state and local government enterprises,State and local government enterprises
S00300,Noncomparable imports,Noncomparable imports
S00401,Scrap,
S00402,Used and secondhand goods,Used and secondhand goods
S00500,Federal general government (defense),Federal government (defense)
S00600,Federal general government (nondefense),Federal government (nondefense)
S00900,Rest of the world adjustment,Rest of the world adjustment