"NAICS_2012_Code","USEEIO_Code","USEEIO_Name","Category","Subcategory","Description"
"327110","327100/US","Clay and ceramic products","31-33: Manufacturing","3271: Clay Product and Refractory Manufacturing","BEA Code & Name is '327100:Clay product and refractory manufacturing'. This industry group comprises (1) Pottery, Ceramics, and Plumbing Fixture Manufacturing, and (2) Clay Building Material and Refractories Manufacturing."
"327120","327100/US","Clay and ceramic products","31-33: Manufacturing","3271: Clay Product and Refractory Manufacturing","BEA Code & Name is '327100:Clay product and refractory manufacturing'. This industry group comprises (1) Pottery, Ceramics, and Plumbing Fixture Manufacturing, and (2) Clay Building Material and Refractories Manufacturing."
"327211","327200/US","Glass and glass products","31-33: Manufacturing","3272: Glass and Glass Product Manufacturing","BEA Code & Name is '327200:Glass and glass product manufacturing'. This industry comprises establishments primarily engaged in manufacturing glass and/or glass products. Establishments in this industry may manufacture glass and/or glass products by melting silica sand or cullet, or purchasing glass."
"327212","327200/US","Glass and glass products","31-33: Manufacturing","3272: Glass and Glass Product Manufacturing","BEA Code & Name is '327200:Glass and glass product manufacturing'. This industry comprises establishments primarily engaged in manufacturing glass and/or glass products. Establishments in this industry may manufacture glass and/or glass products by melting silica sand or cullet, or purchasing glass."
"327213","327200/US","Glass and glass products","31-33: Manufacturing","3272: Glass and Glass Product Manufacturing","BEA Code & Name is '327200:Glass and glass product manufacturing'. This industry comprises establishments primarily engaged in manufacturing glass and/or glass products. Establishments in this industry may manufacture glass and/or glass products by melting silica sand or cullet, or purchasing glass."
"327215","327200/US","Glass and glass products","31-33: Manufacturing","3272: Glass and Glass Product Manufacturing","BEA Code & Name is '327200:Glass and glass product manufacturing'. This industry comprises establishments primarily engaged in manufacturing glass and/or glass products. Establishments in this industry may manufacture glass and/or glass products by melting silica sand or cullet, or purchasing glass."
"327310","327310/US","Cement","31-33: Manufacturing","3273: Cement and Concrete Product Manufacturing","BEA Code & Name is '327310:Cement manufacturing'. This industry comprises establishments primarily engaged in manufacturing portland, natural, masonry, pozzolanic, and other hydraulic cements. Cement manufacturing establishments may calcine earths or mine, quarry, manufacture, or purchase lime."
"327320","327320/US","Ready-mix concrete","31-33: Manufacturing","3273: Cement and Concrete Product Manufacturing","BEA Code & Name is '327320:Ready-mix concrete manufacturing'. This industry comprises establishments, such as batch plants or mix plants, primarily engaged in manufacturing concrete delivered to a purchaser in a plastic and unhardened state. Ready-mix concrete manufacturing establishments may mine, quarry, or purchase sand and gravel."
"327331","327330/US","Concrete pipe, bricks, and blocks","31-33: Manufacturing","3273: Cement and Concrete Product Manufacturing","BEA Code & Name is '327330:Concrete pipe, brick, and block manufacturing'. This industry comprises establishments primarily engaged in manufacturing concrete pipe, brick, and block."
"327332","327330/US","Concrete pipe, bricks, and blocks","31-33: Manufacturing","3273: Cement and Concrete Product Manufacturing","BEA Code & Name is '327330:Concrete pipe, brick, and block manufacturing'. This industry comprises establishments primarily engaged in manufacturing concrete pipe, brick, and block."
"327390","327390/US","Other concrete products","31-33: Manufacturing","3273: Cement and Concrete Product Manufacturing","BEA Code & Name is '327390:Other concrete product manufacturing'. This industry comprises establishments primarily engaged in manufacturing concrete products (except block, brick, and pipe)."
"327410","327400/US","Lime and gypsum products","31-33: Manufacturing","3274: Lime and Gypsum Product Manufacturing","BEA Code & Name is '327400:Lime and gypsum product manufacturing'. This industry group comprises (1) Lime Manufacturing, and (2) Gypsum Product Manufacturing."
"327420","327400/US","Lime and gypsum products","31-33: Manufacturing","3274: Lime and Gypsum Product Manufacturing","BEA Code & Name is '327400:Lime and gypsum product manufacturing'. This industry group comprises (1) Lime Manufacturing, and (2) Gypsum Product Manufacturing."
"327910","327910/US","Abrasive products","31-33: Manufacturing","3279: Other Nonmetallic Mineral Product Manufacturing","BEA Code & Name is '327910:Abrasive product manufacturing'. This industry comprises establishments primarily engaged in manufacturing abrasive grinding wheels of natural or synthetic materials, abrasive-coated products, and other abrasive products."
"327991","327991/US","Cut stone and stone products","31-33: Manufacturing","3279: Other Nonmetallic Mineral Product Manufacturing","BEA Code & Name is '327991:Cut stone and stone product manufacturing'. This U.S. industry comprises establishments primarily engaged in cutting, shaping, and finishing granite, marble, limestone, slate, and other stone for building and miscellaneous uses. Stone product manufacturing establishments may mine, quarry, or purchase stone."
"327992","327992/US","Ground or treated minerals and earth","31-33: Manufacturing","3279: Other Nonmetallic Mineral Product Manufacturing","BEA Code & Name is '327992:Ground or treated mineral and earth manufacturing'. This U.S. industry comprises establishments primarily engaged in calcining, dead burning, or otherwise processing beyond beneficiation, clays, ceramic and refractory minerals, barite, and miscellaneous nonmetallic minerals."
"327993","327993/US","Mineral wool","31-33: Manufacturing","3279: Other Nonmetallic Mineral Product Manufacturing","BEA Code & Name is '327993:Mineral wool manufacturing'. This U.S. industry comprises establishments primarily engaged in manufacturing mineral wool and mineral wool (i.e., fiberglass) insulation products made of such siliceous materials as rock, slag, and glass or combinations thereof."
"327999","327999/US","Other nonmetallic mineral products","31-33: Manufacturing","3279: Other Nonmetallic Mineral Product Manufacturing","BEA Code & Name is '327999:Miscellaneous nonmetallic mineral products'. This U.S. industry comprises establishments primarily engaged in manufacturing nonmetallic mineral products (except pottery, ceramics, and plumbing fixtures; clay building materials and refractories; glass and glass products; cement; ready-mix concrete; concrete products; lime; gypsum products; abrasive products; cut stone and stone products; ground and treated minerals and earth; and mineral wool)."
